source,native,name,p_value,significant,description,term_size,query_size,intersection_size,effective_domain_size,precision,recall,query,parents
GO:MF,GO:0140662,ATP-dependent protein folding chaperone,0.004704768060035125,True,"""Binding to a protein or a protein-containing complex to assist the protein folding process, driven by ATP hydrolysis."" [PMID:27365453]",25,5,2,12683,0.4,0.08,query_1,"['GO:0044183', 'GO:0140657']"
GO:MF,GO:0044183,protein folding chaperone,0.011595114602226706,True,"""Binding to a protein or a protein-containing complex to assist the protein folding process."" [GOC:mtg_cambridge_2009]",39,5,2,12683,0.4,0.05128205128205128,query_1,['GO:0003674']
GO:BP,GO:1903573,negative regulation of response to endoplasmic reticulum stress,0.01972515151300237,True,"""Any process that stops, prevents or reduces the frequency, rate or extent of a response to endoplasmic reticulum stress."" [GO_REF:0000058, GOC:bf, GOC:PARL, GOC:TermGenie, PMID:11381086]",21,5,2,12403,0.4,0.09523809523809523,query_1,"['GO:0034976', 'GO:0048523', 'GO:0048585', 'GO:1905897']"
GO:BP,GO:0045047,protein targeting to ER,0.03293726394762746,True,"""The process of directing proteins towards the endoplasmic reticulum (ER) using signals contained within the protein. One common mechanism uses a 16- to 30-residue signal sequence, typically located at the N-terminus of the protein and containing positively charged amino acids followed by a continuous stretch of hydrophobic residues, which directs the ribosome to the ER membrane and initiates transport of the growing polypeptide across the ER membrane."" [ISBN:0716731363]",27,5,2,12403,0.4,0.07407407407407407,query_1,"['GO:0006605', 'GO:0072599']"
GO:BP,GO:0072599,establishment of protein localization to endoplasmic reticulum,0.040799918701891466,True,"""The directed movement of a protein to a specific location in the endoplasmic reticulum."" [GOC:mah]",30,5,2,12403,0.4,0.06666666666666667,query_1,"['GO:0070972', 'GO:0072594']"
